{
  "$schema": "https://json-schema.org/draft/2020-12/schema",
  "$id": "https://agent-teams.ai/schemas/scaffold-recovery-journal",
  "title": "Scaffold Recovery Journal",
  "type": "object",
  "additionalProperties": false,
  "required": ["schemaVersion", "state", "plan", "operations"],
  "properties": {
    "schemaVersion": { "const": 1 },
    "state": { "const": "PREPARED" },
    "plan": { "$ref": "https://agent-teams.ai/schemas/scaffold-plan" },
    "operations": {
      "type": "array",
      "minItems": 1,
      "maxItems": 4096,
      "items": { "$ref": "#/$defs/operation" }
    }
  },
  "$defs": {
    "operation": {
      "type": "object",
      "additionalProperties": false,
      "required": ["operationId", "path", "state"],
      "properties": {
        "operationId": { "type": "string", "minLength": 1, "maxLength": 214 },
        "path": { "type": "string", "minLength": 1, "maxLength": 512, "pattern": "^(?!.*(?:^|/)\\.{1,2}(?:/|$))[A-Za-z0-9._@-]+(?:/[A-Za-z0-9._@-]+)*$" },
        "state": { "enum": ["pending", "publishing", "published", "preexisting"] }
      }
    }
  }
}
